{
  "identifier": "fabr-cdktf-gcp",
  "vendor": "FABR",
  "license": "UNLICENSED",
  "cdf": "1.x",
  "name": "A test package built by CDKTF for AWS",
  "description": "This package is for testing only",
  "support": {
    "email": "hello@abc.com",
    "phone": "0800123456789"
  },
  "tooling": {
    "command": "cdktf deploy",
    "runtime": "cdktf",
    "language": "typescript"
  },
  "constructs": {
    "schema": "schema.json",
    "network": {
      "icon": "https://abc.com/network.png"
    },
    "components": {
      "hello": { "type": "chinese", "subtype": "mandarin" },
      "fizz": { "type": "city", "subtype": "hong-kong" }
    },
    "services": {
      "world": { "type": "solar-system", "subtype": "earth" },
      "buzz": { "type": "country", "subtype": "morocco" }

    },
    "relations": {
      "hello": "world",
      "fizz": "buzz"
    },
    "custom": {
      "icon": "https://abc.com/code.png",
      "template": "template.ts"
    }
  }
}
