{
  "identifier": "fabr-cdktf-gcp",
  "vendor": "FABR",
  "license": "UNLICENSED",
  "cdf": "1.x",
  "tooling": {
    "command": "cdktf deploy",
    "runtime": "cdktf",
    "language": "typescript"
  },
  "constructs": {
    "schema": "schema.json",
    "network": {},
    "components": {
      "hello": { "type": "chinese", "subtype": "mandarin" },
      "fizz": { "type": "city", "subtype": "hong-kong" }
    },
    "services": {
      "world": { "type": "solar-system", "subtype": "earth" },
      "buzz": { "type": "country", "subtype": "morocco" }

    },
    "relations": {
      "hello": "world",
      "fizz": "buzz"
    },
    "custom": {
      "template": "template.ts"
    }
  }
}
